{
  "contract": "ctx.external-form-evidence.v1",
  "operation_id": "10000000-0000-4000-8000-000000000001",
  "packet_digest": "aaaaaaaaaaaaaaaaaaaaaaaaaaaaaaaaaaaaaaaaaaaaaaaaaaaaaaaaaaaaaaaa",
  "plan_digest": "bbbbbbbbbbbbbbbbbbbbbbbbbbbbbbbbbbbbbbbbbbbbbbbbbbbbbbbbbbbbbbbb",
  "observed_at": "2026-09-14T12:00:00Z",
  "url": "https://portal.example/case/42",
  "identity_text": "42",
  "confirmation_text": "Saved",
  "values": {
    "experience": "Built a context service"
  },
  "errors": [],
  "phase": "submitted"
}
